timestamp,catalog_revision,pr_ref,finding_brief,classification,proposed_catalog_slug,status
2026-05-25T21:30:00Z,92f0622b5986ddfbb75419e767d628134762e478,seed-pr-1,Volatile write ordering inside lock,panel-miss,publication-barrier-order,catalog-updated
2026-05-25T21:30:00Z,92f0622b5986ddfbb75419e767d628134762e478,seed-pr-1,Test event-subscription before subject-action,panel-miss,event-ordering-test-subscription,catalog-updated
2026-05-25T21:30:00Z,92f0622b5986ddfbb75419e767d628134762e478,seed-pr-1,Test event-subscription before subject-action,panel-miss,event-ordering-test-subscription,catalog-updated
2026-05-25T21:35:00Z,92f0622b5986ddfbb75419e767d628134762e478,seed-pr-1,Event invocation before completion drops awaiter on subscriber throw,panel-miss,event-completion-fault-isolation,catalog-updated
2026-05-25T21:35:00Z,92f0622b5986ddfbb75419e767d628134762e478,seed-pr-1,Event invocation before completion drops awaiter on subscriber throw,panel-miss,event-completion-fault-isolation,catalog-updated
2026-05-25T21:35:00Z,92f0622b5986ddfbb75419e767d628134762e478,seed-pr-1,Event invocation before completion drops awaiter on subscriber throw,panel-miss,event-completion-fault-isolation,catalog-updated
2026-05-25T21:40:00Z,92f0622b5986ddfbb75419e767d628134762e478,seed-pr-1,New test class lacks Arrange/Act/Assert structure,panel-miss,test-aaa-pattern,catalog-updated
2026-05-26T00:39:17Z,06749e54aa73832c019812aba01b971579ce5466,consuming-pr-3,Registration method accepts strongly-typed-id sentinel/None value as a match,panel-miss,strongly-typed-id-none-rejection,pending
2026-05-26T00:39:17Z,06749e54aa73832c019812aba01b971579ce5466,consuming-pr-3,Record with non-nullable reference-type parameter lacks construction-time null check,panel-miss,record-non-nullable-ctor-validation,pending
2026-05-26T01:05:24Z,d5ec0bff1825c5fbe2b1cd0ee3b358075cca9caa,consuming-pr-3,State-reader returns stale registration between event-publishing source and event-subscribing observer's reactive clear,panel-miss,state-read-stale-after-event-publication,pending
2026-05-26T01:05:24Z,d5ec0bff1825c5fbe2b1cd0ee3b358075cca9caa,consuming-pr-3,Record/class invariant set in constructor is bypassable by init-settable properties via with-expression,panel-miss,init-property-invariant-bypass,pending
2026-05-26T01:26:57Z,4692b9c36be5c2b6ed8868af51f155f77c345cc5,consuming-pr-3,Stale-state-read fix applied to read methods but not to write/decision methods that read the same field,panel-miss,stale-read-fix-coverage-completeness,pending
2026-05-26T01:26:57Z,4692b9c36be5c2b6ed8868af51f155f77c345cc5,consuming-pr-3,PR description claims an API type kind (record/class/struct) that does not match the implementation,panel-miss,pr-description-api-surface-sync,pending
2026-05-26T02:20:54Z,340fab96eecd91daf51cd2d7b49e760d310a466f,consuming-pr-4,Pre-impl panel assumed earlier-PR-merged API surface still matched its pre-merge state (missed that prior-PR added base-class virtual overrides),panel-miss,cross-pr-api-state-propagation,pending
2026-05-26T03:00:45Z,8485c787843f6f67a4499ee4f0d1afda9bfb1b51,external-scan-batch-1,Dead/unused code paths or variables that no caller exercises (external-scan: 30 occurrences across consuming-projects),panel-miss,dead-code-unused,pending
2026-05-26T03:00:45Z,8485c787843f6f67a4499ee4f0d1afda9bfb1b51,external-scan-batch-1,Possible null-dereference where the receiver can be null at the point of access (external-scan: 29 occurrences across consuming-projects),panel-miss,null-dereference-risk,pending
2026-05-26T03:00:45Z,8485c787843f6f67a4499ee4f0d1afda9bfb1b51,external-scan-batch-1,Inline code comment describes behavior that no longer matches the code below it (external-scan: 26 occurrences across consuming-projects),panel-miss,code-comment-mismatch,pending
2026-05-26T03:00:45Z,8485c787843f6f67a4499ee4f0d1afda9bfb1b51,external-scan-batch-1,New early-return or guard silently suppresses behavior the prior code path supported (external-scan: 13 occurrences across consuming-projects),panel-miss,behavior-suppressed-by-guard,pending
2026-05-26T03:00:45Z,8485c787843f6f67a4499ee4f0d1afda9bfb1b51,external-scan-batch-1,File path constructed from untrusted input without traversal guard or canonicalization (external-scan: 13 occurrences across consuming-projects),panel-miss,file-path-injection-traversal,pending
2026-05-26T03:00:45Z,8485c787843f6f67a4499ee4f0d1afda9bfb1b51,external-scan-batch-1,Configuration key consumed without a documented default or fallback when absent (external-scan: 12 occurrences across consuming-projects),panel-miss,config-default-missing,pending
2026-05-26T03:00:45Z,8485c787843f6f67a4499ee4f0d1afda9bfb1b51,external-scan-batch-1,Identifier spelling or naming inconsistent with adjacent symbols in the same module (external-scan: 9 occurrences across consuming-projects),panel-miss,typo-naming-inconsistency,pending
2026-05-26T03:00:45Z,8485c787843f6f67a4499ee4f0d1afda9bfb1b51,external-scan-batch-1,Type or method lacks an attribute the surrounding code expects (e.g. routing, authorization, serialization) (external-scan: 8 occurrences across consuming-projects),panel-miss,attribute-or-decorator-missing,pending
2026-05-26T03:00:45Z,8485c787843f6f67a4499ee4f0d1afda9bfb1b51,external-scan-batch-1,User-visible string hard-coded in source rather than going through localization/resource catalog (external-scan: 8 occurrences across consuming-projects),panel-miss,localization-i18n-gap,pending
2026-05-26T03:00:45Z,8485c787843f6f67a4499ee4f0d1afda9bfb1b51,external-scan-batch-1,Shared state read or written without synchronization across threads or async continuations (external-scan: 7 occurrences across consuming-projects),panel-miss,race-condition-thread-safety,pending
2026-05-26T03:00:45Z,8485c787843f6f67a4499ee4f0d1afda9bfb1b51,external-scan-batch-1,Identifier uses a naming style reserved for a different scope (e.g. underscore-prefix on locals) (external-scan: 6 occurrences across consuming-projects),panel-miss,naming-convention-violation,pending
2026-05-26T03:00:45Z,8485c787843f6f67a4499ee4f0d1afda9bfb1b51,external-scan-batch-1,Third-party GitHub Action referenced by tag or floating ref instead of pinned commit SHA (external-scan: 6 occurrences across consuming-projects),panel-miss,github-actions-not-pinned-to-sha,pending
2026-05-26T03:00:45Z,8485c787843f6f67a4499ee4f0d1afda9bfb1b51,external-scan-batch-1,Code silently falls back to a default value without logging or surfacing the failed path (external-scan: 6 occurrences across consuming-projects),panel-miss,silent-fallback-loses-info,pending
2026-05-26T03:00:45Z,8485c787843f6f67a4499ee4f0d1afda9bfb1b51,external-scan-batch-1,IDisposable / IAsyncDisposable instance not disposed on all paths (no using, no finalizer, no Dispose call) (external-scan: 5 occurrences across consuming-projects),panel-miss,dispose-leak,pending
2026-05-26T03:00:45Z,8485c787843f6f67a4499ee4f0d1afda9bfb1b51,external-scan-batch-1,Async/await pattern likely to deadlock or drop exceptions (.Result/.Wait, async void outside event handlers, fire-and-forget) (external-scan: 5 occurrences across consuming-projects),panel-miss,async-await-misuse,pending
2026-05-26T03:00:45Z,8485c787843f6f67a4499ee4f0d1afda9bfb1b51,external-scan-batch-1,Hard-coded string or numeric literal that should be a named constant (external-scan: 5 occurrences across consuming-projects),panel-miss,magic-string-numeric-literal,pending
2026-05-26T03:00:45Z,8485c787843f6f67a4499ee4f0d1afda9bfb1b51,external-scan-batch-1,Index or loop bound may exceed the collection range by one element (external-scan: 4 occurrences across consuming-projects),panel-miss,off-by-one-bounds,pending
2026-05-26T03:00:45Z,8485c787843f6f67a4499ee4f0d1afda9bfb1b51,external-scan-batch-1,Public method accepts untrusted input without length, format, or range validation (external-scan: 4 occurrences across consuming-projects),panel-miss,input-validation-missing,pending
2026-05-26T03:00:45Z,8485c787843f6f67a4499ee4f0d1afda9bfb1b51,external-scan-batch-1,User input rendered into HTML/JS context without encoding or sanitization (external-scan: 4 occurrences across consuming-projects),panel-miss,xss-injection-risk,pending
2026-05-26T03:00:45Z,8485c787843f6f67a4499ee4f0d1afda9bfb1b51,external-scan-batch-1,Shell script missing strict-mode pragmas (set -euo pipefail or equivalent) used elsewhere in the repo (external-scan: 4 occurrences across consuming-projects),panel-miss,shell-script-discipline,pending
2026-05-26T03:00:45Z,8485c787843f6f67a4499ee4f0d1afda9bfb1b51,external-scan-batch-1,Same logic repeated across multiple methods/files; refactor candidate (external-scan: 3 occurrences across consuming-projects),panel-miss,code-duplication-dry,pending
